{
  "schema_version": 1,
  "kind": "session",
  "id": "sess_fixture_youtube",
  "name": "youtube-play-music",
  "status": "completed",
  "started_at": "2026-06-21T00:00:00.000Z",
  "ended_at": "2026-06-21T00:00:05.000Z",
  "end_reason": "fixture",
  "platform": {
    "os": "macos",
    "arch": "arm64"
  },
  "demo": {
    "kind": "youtube-play-music",
    "default_query": "study jazz music",
    "browser": "Google Chrome",
    "requires_login": false
  },
  "artifacts": {
    "events_path": "examples/youtube-play-music/events.jsonl",
    "workflow_path": null,
    "replay_trace_path": null
  }
}
